{
  "id": "00000001-0000-4000-8000-000000000001",
  "reference": "BOOKING-EXAMPLE",
  "version": 3,
  "readiness": "changes_required",
  "latest_report_id": "00000002-0000-4000-8000-000000000001",
  "open_issue_count": 1,
  "next_action": "Preview correction request",
  "confirmed_deadline": null,
  "updated_at": "2026-09-18T08:00:00Z"
}
